[
  {
    "id": "ev_northstar_ops_studio_website",
    "account_id": "acct_northstar_ops_studio",
    "source_type": "website",
    "source_url": "https://northstar-ops.example",
    "claim": "Website listed for account: https://northstar-ops.example",
    "captured_at": "2026-06-11T22:30:00.000Z",
    "confidence": "medium"
  },
  {
    "id": "ev_northstar_ops_studio_segment",
    "account_id": "acct_northstar_ops_studio",
    "source_type": "target_csv",
    "source_url": "inputs/targets.csv",
    "claim": "Segment from target list: solo_consultant",
    "captured_at": "2026-06-11T22:30:00.000Z",
    "confidence": "high"
  },
  {
    "id": "ev_northstar_ops_studio_note_1",
    "account_id": "acct_northstar_ops_studio",
    "source_type": "operator_note",
    "source_url": "inputs/targets.csv",
    "claim": "Founder sells RevOps retainers.",
    "captured_at": "2026-06-11T22:30:00.000Z",
    "confidence": "medium"
  },
  {
    "id": "ev_northstar_ops_studio_note_2",
    "account_id": "acct_northstar_ops_studio",
    "source_type": "operator_note",
    "source_url": "inputs/targets.csv",
    "claim": "tracks leads in spreadsheets.",
    "captured_at": "2026-06-11T22:30:00.000Z",
    "confidence": "medium"
  },
  {
    "id": "ev_northstar_ops_studio_source",
    "account_id": "acct_northstar_ops_studio",
    "source_type": "target_csv",
    "source_url": "inputs/targets.csv",
    "claim": "Imported from source: demo fixture",
    "captured_at": "2026-06-11T22:30:00.000Z",
    "confidence": "high"
  },
  {
    "id": "ev_brightlane_creative_website",
    "account_id": "acct_brightlane_creative",
    "source_type": "website",
    "source_url": "https://brightlane.example",
    "claim": "Website listed for account: https://brightlane.example",
    "captured_at": "2026-06-11T22:30:00.000Z",
    "confidence": "medium"
  },
  {
    "id": "ev_brightlane_creative_segment",
    "account_id": "acct_brightlane_creative",
    "source_type": "target_csv",
    "source_url": "inputs/targets.csv",
    "claim": "Segment from target list: boutique_agency",
    "captured_at": "2026-06-11T22:30:00.000Z",
    "confidence": "high"
  },
  {
    "id": "ev_brightlane_creative_note_1",
    "account_id": "acct_brightlane_creative",
    "source_type": "operator_note",
    "source_url": "inputs/targets.csv",
    "claim": "Eight-person web agency with project-based leads.",
    "captured_at": "2026-06-11T22:30:00.000Z",
    "confidence": "medium"
  },
  {
    "id": "ev_brightlane_creative_note_2",
    "account_id": "acct_brightlane_creative",
    "source_type": "operator_note",
    "source_url": "inputs/targets.csv",
    "claim": "inconsistent follow-up process.",
    "captured_at": "2026-06-11T22:30:00.000Z",
    "confidence": "medium"
  },
  {
    "id": "ev_brightlane_creative_source",
    "account_id": "acct_brightlane_creative",
    "source_type": "target_csv",
    "source_url": "inputs/targets.csv",
    "claim": "Imported from source: demo fixture",
    "captured_at": "2026-06-11T22:30:00.000Z",
    "confidence": "high"
  },
  {
    "id": "ev_atlas_founder_labs_website",
    "account_id": "acct_atlas_founder_labs",
    "source_type": "website",
    "source_url": "https://atlas-founder-labs.example",
    "claim": "Website listed for account: https://atlas-founder-labs.example",
    "captured_at": "2026-06-11T22:30:00.000Z",
    "confidence": "medium"
  },
  {
    "id": "ev_atlas_founder_labs_segment",
    "account_id": "acct_atlas_founder_labs",
    "source_type": "target_csv",
    "source_url": "inputs/targets.csv",
    "claim": "Segment from target list: founder_led_b2b",
    "captured_at": "2026-06-11T22:30:00.000Z",
    "confidence": "high"
  },
  {
    "id": "ev_atlas_founder_labs_note_1",
    "account_id": "acct_atlas_founder_labs",
    "source_type": "operator_note",
    "source_url": "inputs/targets.csv",
    "claim": "Early B2B SaaS team doing founder-led sales.",
    "captured_at": "2026-06-11T22:30:00.000Z",
    "confidence": "medium"
  },
  {
    "id": "ev_atlas_founder_labs_note_2",
    "account_id": "acct_atlas_founder_labs",
    "source_type": "operator_note",
    "source_url": "inputs/targets.csv",
    "claim": "many demo notes in docs.",
    "captured_at": "2026-06-11T22:30:00.000Z",
    "confidence": "medium"
  },
  {
    "id": "ev_atlas_founder_labs_source",
    "account_id": "acct_atlas_founder_labs",
    "source_type": "target_csv",
    "source_url": "inputs/targets.csv",
    "claim": "Imported from source: demo fixture",
    "captured_at": "2026-06-11T22:30:00.000Z",
    "confidence": "high"
  },
  {
    "id": "ev_cedar_grant_partners_website",
    "account_id": "acct_cedar_grant_partners",
    "source_type": "website",
    "source_url": "https://cedar-grants.example",
    "claim": "Website listed for account: https://cedar-grants.example",
    "captured_at": "2026-06-11T22:30:00.000Z",
    "confidence": "medium"
  },
  {
    "id": "ev_cedar_grant_partners_segment",
    "account_id": "acct_cedar_grant_partners",
    "source_type": "target_csv",
    "source_url": "inputs/targets.csv",
    "claim": "Segment from target list: professional_services",
    "captured_at": "2026-06-11T22:30:00.000Z",
    "confidence": "high"
  },
  {
    "id": "ev_cedar_grant_partners_note_1",
    "account_id": "acct_cedar_grant_partners",
    "source_type": "operator_note",
    "source_url": "inputs/targets.csv",
    "claim": "Grant writing consultancy with many warm relationships.",
    "captured_at": "2026-06-11T22:30:00.000Z",
    "confidence": "medium"
  },
  {
    "id": "ev_cedar_grant_partners_note_2",
    "account_id": "acct_cedar_grant_partners",
    "source_type": "operator_note",
    "source_url": "inputs/targets.csv",
    "claim": "deadline-driven follow-up windows.",
    "captured_at": "2026-06-11T22:30:00.000Z",
    "confidence": "medium"
  },
  {
    "id": "ev_cedar_grant_partners_source",
    "account_id": "acct_cedar_grant_partners",
    "source_type": "target_csv",
    "source_url": "inputs/targets.csv",
    "claim": "Imported from source: demo fixture",
    "captured_at": "2026-06-11T22:30:00.000Z",
    "confidence": "high"
  },
  {
    "id": "ev_quickscale_outreach_website",
    "account_id": "acct_quickscale_outreach",
    "source_type": "website",
    "source_url": "https://quickscale-outreach.example",
    "claim": "Website listed for account: https://quickscale-outreach.example",
    "captured_at": "2026-06-11T22:30:00.000Z",
    "confidence": "medium"
  },
  {
    "id": "ev_quickscale_outreach_segment",
    "account_id": "acct_quickscale_outreach",
    "source_type": "target_csv",
    "source_url": "inputs/targets.csv",
    "claim": "Segment from target list: automation_vendor",
    "captured_at": "2026-06-11T22:30:00.000Z",
    "confidence": "high"
  },
  {
    "id": "ev_quickscale_outreach_note_1",
    "account_id": "acct_quickscale_outreach",
    "source_type": "operator_note",
    "source_url": "inputs/targets.csv",
    "claim": "Vendor advertises autonomous high-volume outbound and asks for platform automation at scale.",
    "captured_at": "2026-06-11T22:30:00.000Z",
    "confidence": "medium"
  },
  {
    "id": "ev_quickscale_outreach_source",
    "account_id": "acct_quickscale_outreach",
    "source_type": "target_csv",
    "source_url": "inputs/targets.csv",
    "claim": "Imported from source: demo fixture",
    "captured_at": "2026-06-11T22:30:00.000Z",
    "confidence": "high"
  }
]
